,Company Information,,,,,,,Services,,,Quality,,,,Facility,,,,,,,,,,,,,Users,,,,,,,,Upload feature - Documents,
197,PROTON METALCRAFTS PVT.LTD.,"Plot No-26,27, 28, Tiny ind. Co-Op Estate Ltd, Kondhwa Budnak, Tyni Audyogic Wasahat, Kondhwa, Pune, Maharashtra 411048, India",https://www.protonmetalcrafts.com/,919970098333,"Kirloskar, Bharath Forge, Godrej, Piaggio, etc","India, Sweden, Germany, USA, etc.",NA,"Automotive,Aerospace,Defense,Machinery & Equipments,Steel,Oil & Gas,Consumer Goods,Healthcare,Robotics,Hardware Startups,Electrical & Electronics",CNC Machining,"CNC Machining: Plain Carbon and Low Alloy Steels,CNC Machining: Stainless Steels,CNC Machining: Aluminium Alloys,CNC Machining: Brass,CNC Machining: Titanium,CNC Machining: Mild Steel,CNC Machining: Copper,CNC Machining: Plastics","ISO 9001,AS 9100","CMM,Manual",NA,NA,18000 sq ft,Yes,Yes,Yes,NA,70,NA,NA,NA,NA,NA,NA,NA,Vivek,Director,viveklupane@protonmetalcrafts.com,9970098333,,,,,,
198,Sunrise Technologies,"A367, 6th Main, 7th Cross Rd, Peenya 1st Stage, Netaji Nagar, Peenya, Bengaluru, Karnataka 560058, India",http://sunrisegrp.com/,918032323466,"John Crane, BFW, DMG Moori, TEREX, etc",India & Germany,NA,"Automotive,Machinery & Equipments,Consumer Goods,Hardware Startups,Electrical & Electronics",CNC Machining,"CNC Machining: Plain Carbon and Low Alloy Steels,CNC Machining: Stainless Steels,CNC Machining: Aluminium Alloys,CNC Machining: Brass,CNC Machining: Titanium,CNC Machining: Mild Steel,CNC Machining: Copper",ISO 9001,Manual,Manufacturing facility is supported by the customized ERP software This soft ware provides control over the areas. Technology Manufacturing facility is supported by the customized ERP software This soft ware provides control over the areas. ïƒ¼ Budgeting ïƒ¼ Sales ïƒ¼ Production ïƒ¼ Materials Management ïƒ¼ Stores ïƒ¼ Subcontracting ïƒ¼ HR ïƒ¼ Accounts.,NA,NA,Yes,Yes,Yes,NA,70,8,2,6,NA,NA,NA,NA,Ramesha,Proprietor,ramesh@sunrisegrp.com,9198800502,,,,,,
199,Heatech Engineers,Kanchipuram,,,,,,"Automotive, Hydraulic End Fittings, General Engineering",Cold Forging,,,,,,,,,,,,,,,,,,,,,,,,,,,,
200,Bansal Precision Forge,Bangalore Urban,,,,,,"Automotive, Defense, Agriculture, Capital Equipments",Forging,,,,,,,,,,,,,,,,,,,,,,,,,,,,
201,Naetek Ferrocast,Shimoga,,,,,,"Pumps and Valves, Heavy Diesel Engine, Material Handling, Hydraulic & Compressor Equipments, Earth Moving, General Engineering, Refrigeration, Power generation",Sand Casting,,,,,,,,,,,,,,,,,,,,,,,,,,,,
202,Naetek Ferrocast Machining,Shimoga,,,,,,"Valves & Pumps, Hydraulic & Compressor, Earth Moving, General Engineering",CNC Machining,,,,,,,,,,,,,,,,,,,,,,,,,,,,
203,Precision Engineering,Tiruvallur,,,,,,"OEMs, Automobile",CNC Machining,,,,,,,,,,,,,,,,,,,,,,,,,,,,
204,AGN Electro Coats,Bangalore Urban,,,,,,"Electrical & Electronics, Automotive",Others,,,,,,,,,,,,,,,,,,,,,,,,,,,,
205,M G Enterprises,Bangalore Urban,,,,,,"Aircraft, Aerospace, Defense Hardware, Electronics, Automotive",CNC Machining,,,,,,,,,,,,,,,,,,,,,,,,,,,,
206,Glow Flow,Chennai,,,,,,"Valves, Railways, Jigs & Fixture",CNC Machining,,,,,,,,,,,,,,,,,,,,,,,,,,,,
207,Inder Enterprises,Ghaziabad,,,,,,"Railways & Defense, Plant & Machinery, Steel Mill Manufacturing, Die and Molds, Jigs & Fixture, Machine Tools, Printing and Packaging Machinery, Industrial Transmission",CNC Machining,,,,,,,,,,,,,,,,,,,,,,,,,,,,
208,Indore CNC,Dhar,,,,,,"Automobile, Railways, Energy, Defence",CNC Machining,,,,,,,,,,,,,,,,,,,,,,,,,,,,
209,New Tech Solutions,Pune,,,,,,"Casting, Press Tools, Jigs & Fixtures",CNC Machining,,,,,,,,,,,,,,,,,,,,,,,,,,,,
210,Nitin Casting,Thane,,,,,,"Fertilizers, Chemical, Mining, Refinery & Petrochemical, Chemical Industries, Valve & Pumps, Defence, Surgical Instruments, Marine, Automotive, Aerospace, General Engineering","Sand Casting, Centrifugal Casting, Shell Moulding, Investment Casting",,,,,,,,,,,,,,,,,,,,,,,,,,,,
211,Real Tech Engineering,Rajkot,,,,,,,"CNC Machining, Closed Die Forging",,,,,,,,,,,,,,,,,,,,,,,,,,,,
212,Shree Shakti Heat Treaters,Bengaluru,,,,,,,,,,,,,,,,,,,,,,,,,,,,,,,,,,,
213,Sivas S&S Products,Kadambathur,,,,,,"Valves & Pumps, Automobile, Agriculture, General Engineering, Aerospace, Surgical Components, Defence Industries",Investment Casting,,,,,,,,,,,,,,,,,,,,,,,,,,,,
214,SRI MOOGAMBIKAI PRECISION PRODUCTS,Chennai,,,,,,"General Engineering, Jigs & Fixture",CNC Machining,,,,,,,,,,,,,,,,,,,,,,,,,,,,
215,Surasa Engineering,Pimpri-Chinchwad,,,,,,"Jigs & Fixture, Oil & Gas, Automobile, General Engineering, Aerospace, Defense",CNC Machining,,,,,,,,,,,,,,,,,,,,,,,,,,,,
216,KAPEEL ENTERPRISE,Belagavi,,,,,,,Sand Casting,,,,,,,,,,,,,,,,,,,,,,,,,,,,
217,Atul Technocast Pvt Ltd.,Junagadh,,,,,,,"Sand Casting, Investment Casting",,,,,,,,,,,,,,,,,,,,,,,,,,,,
218,Arise Precision Casting,Rajkot,,,,,,"Automotive, Valves & Pumps, General Engineering, Mining, Steel, Power & Energy, Aerospace, Railways, Defence, Boiler, Construction Equipment, Earth Moving",Investment Casting,,,,,,,,,,,,,,,,,,,,,,,,,,,,
219,Sagar Ferex,Rajkot,,,,,,"Agricultural Equipment, Automotive, Gear Box, Valves & Pumps, Railways, Construction Equipment, General Engineering, Electrical",Sand Casting,,,,,,,,,,,,,,,,,,,,,,,,,,,,
220,Kevin Industries,Rajkot,,,,,,Oil Engine,Die Casting,,,,,,,,,,,,,,,,,,,,,,,,,,,,
221,HH Precision Casting,Rajkot,,,,,,"Valves & Pumps, Automotive, General Engineering, Refrigeration","Investment Casting, Sand Casting, Die Casting, Centrifugal Casting",,,,,,,,,,,,,,,,,,,,,,,,,,,,
222,Raj Precision Industries,Rajkot,,,,,,"Automotive, Construction Equipment, Valves & Pumps",Cold Forging,,,,,,,,,,,,,,,,,,,,,,,,,,,,
223,Shivya Forge,Banaskantha,,,,,,"Automotive, Gear Box, Valves & Pumps, Steel, Oil & Gas, Power","Open Die Forging, Closed Die Forging, Ring Forging",,,,,,,,,,,,,,,,,,,,,,,,,,,,
224,Acme Forging,Rajkot,,,,,,"Electrical, Defence",Open Die Forging,,,,,,,,,,,,,,,,,,,,,,,,,,,,
225,Jagdambay Forgings,Ludhiana,,,,,,"Agricultural Equipment, Railways, Automotive","Open Die Forging, Closed Die Forging",,,,,,,,,,,,,,,,,,,,,,,,,,,,
226,Singla Forging Pvt Ltd,Rohtak,,,,,,Automotive,"Cold Forging, Open Die Forging, Closed Die Forging",,,,,,,,,,,,,,,,,,,,,,,,,,,,
227,AL-FAIZA Forging and Engineering works,Thane,,,,,,,,,,,,,,,,,,,,,,,,,,,,,,,,,,,
228,MPH Precision Castings Pvt Ltd,Mehsana,,,,,,"Valves & Pumps, General Engineering, Aerospace, Automotive, Chemical Industries, Food Processing, Pharma, Textile",Investment Casting,,,,,,,,,,,,,,,,,,,,,,,,,,,,
229,Spectra Cast Pvt Ltd,Vajdi,,,,,,Valves & Pumps,Investment Casting,,,,,,,,,,,,,,,,,,,,,,,,,,,,
230,Creative Castings Ltd,Junagadh,,,,,,"Valves & Pumps, Fire & Safety, Food Processing, Flow & Process Control",Investment Casting,,,,,,,,,,,,,,,,,,,,,,,,,,,,
231,Pentagon Forge & Machine Ltd,Rajkot,,,,,,"Oil & Gas, Infrastructure & Mining, Automotive",Closed Die Forging,,,,,,,,,,,,,,,,,,,,,,,,,,,,
232,Surendra Forgings Pvt Ltd,"Thane, Chakan",,,,,,"Automotive, Petrochemical, Earth Moving, Farm Equipment","Closed Die Forging, Open Die Forging",,,,,,,,,,,,,,,,,,,,,,,,,,,,
233,Innox Precision Pvt Ltd,Lothada,,,,,,"Automotive, Aerospace, Agricultural Equipment, Hydraulic Equipment, Material Handing, Oil & Gas, Railways, Valves & Pumps",CNC Machining,,,,,,,,,,,,,,,,,,,,,,,,,,,,
234,Primeseal Precision Cast Pvt Ltd,Rajkot,,,,,,"Agricultural Equipment, Automotive, Valves & Pumps",Investment Casting,,,,,,,,,,,,,,,,,,,,,,,,,,,,
235,Advance Technoforge Pvt Ltd,,,,,,,,,,,,,,,,,,,,,,,,,,,,,,,,,,,,
236,Infinity Cast,Rajkot,,,,,,"Automotive, Gas Turbines, Aerospace, Oil & Gas, Valves & Pumps, Power , Textile, Railways",Investment Casting,,,,,,,,,,,,,,,,,,,,,,,,,,,,
237,Noble Cast Comp Pvt Ltd,Pune,,,,,,"Automobile, Power , Pump, Construction","Die Casting, Gravity Die Casting",,,,,,,,,,,,,,,,,,,,,,,,,,,,
238,Ratna Udyog,Kolhapur,,,,,,"Automotive, Hydraulic Valve, Valves & Pumps, Power & Energy",Shell Moulding,,,,,,,,,,,,,,,,,,,,,,,,,,,,
239,Advisha Dye Cast Industries Pvt Ltd,Alate,,,,,,"Automotive, Agricultural Equipment",Die Casting,,,,,,,,,,,,,,,,,,,,,,,,,,,,
240,KEMS Forging Ltd,Bangalore Urban,,,,,,"Automotive, Hydraulics, Earth Moving, Oil & Gas, Defence, Railways, Energy","Open Die Forging, Ring Forging, Closed Die Forging",,,,,,,,,,,,,,,,,,,,,,,,,,,,
241,P.C. Sons Castings Private Limited,Coimbatore,,,,,,"Automotive, Hydraulic Valve, Construction Equipment, Valves & Pumps, Transmission, Wind Mill, General Engineering",Sand Casting,,,,,,,,,,,,,,,,,,,,,,,,,,,,
242,Trinity India Forgetech,Pune,,,,,,"Aerospace, Automotive, Infrastructure & Mining, Nuclear",Closed Die Forging,,,,,,,,,,,,,,,,,,,,,,,,,,,,
243,Emerson Forge Pvt Ltd,,,,,,,,,,,,,,,,,,,,,,,,,,,,,,,,,,,,
244,Lawa Fasteners Pvt. Ltd.,Pune,,,,,,"Construction Equipment, Automotive, Earth Moving",Cold Forging,,,,,,,,,,,,,,,,,,,,,,,,,,,,
245,Perfect Group,Ludhiana,,,,,,,,,,,,,,,,,,,,,,,,,,,,,,,,,,,
246,Victory Precisions Pvt. Ltd.,Pune,,,,,,"Automotive, Power & Energy",Gravity Die Casting,,,,,,,,,,,,,,,,,,,,,,,,,,,,
247,Ghanshyam Industries,,,,,,,"Automotive, Electrical & Electronics, Marine",,,,,,,,,,,,,,,,,,,,,,,,,,,,,
248,Marcus Hi-Tech Engineering Pvt Ltd,Coimbatore,,,,,,,,,,,,,,,,,,,,,,,,,,,,,,,,,,,
249,Rajashri Enterprises,,,,,,,,,,,,,,,,,,,,,,,,,,,,,,,,,,,,
250,VIRAJ TECHNOCAST PVT. LTD.,Rajkot,,,,,,"Valves & Pumps, Marine, Earth Moving, Oil & Gas, Construction Equipment",Sand Casting,,,,,,,,,,,,,,,,,,,,,,,,,,,,
251,Uni Abex Alloy Products Limited,Dharwad,,,,,,"Steel, Petrochemical","Centrifugal Casting, Sand Casting",,,,,,,,,,,,,,,,,,,,,,,,,,,,
252,Sanjivani casting Pvt. Ltd,Rajkot,,,,,,"Oil & Gas, Valves & Pumps, General Engineering, Food Processing","Investment Casting, Sand Casting",,,,,,,,,,,,,,,,,,,,,,,,,,,,
253,Global Metal Forgings Ltd,Palghar,,,,,,"Oil & Gas, Railways, Defence, Marine, Automotive",Closed Die Forging,,,,,,,,,,,,,,,,,,,,,,,,,,,,
254,Nikita International Metal Solutions,Ghaziabad,,,,,,"Automotive, Construction Equipment","Sheet Metal Stamping, Deep Drawing",,,,,,,,,,,,,,,,,,,,,,,,,,,,
255,BK TECH ENTERPRISE INC.,Rajkot,,,,,,,"Investment Casting, Sand Casting, Closed Die Forging",,,,,,,,,,,,,,,,,,,,,,,,,,,,
256,Shailesh Forging Works,Ravki,,,,,,"Automotive, Valves & Pumps","Ring Forging, Open Die Forging, Closed Die Forging",,,,,,,,,,,,,,,,,,,,,,,,,,,,
257,Millennium Forging Pvt Ltd,,,,,,,"Automotive, Oil Field, Valves & Pumps, Transmission, Earth Moving, Mining, General Engineering","Closed Die Forging, Ring Forging",,,,,,,,,,,,,,,,,,,,,,,,,,,,
258,Phoenix Forge Pvt Ltd,Yeladadalu,,,,,,"Commercial Vehicles, Tillers & Tractors, Engines, Earth Moving, Conveyors, Hydraulics, Defense",Closed Die Forging,,,,,,,,,,,,,,,,,,,,,,,,,,,,
259,Inshape Precision Component Pvt. Ltd,Rajkot,,,,,,"Valves & Pumps, General Engineering, Agriculture Machinery Parts, Aerospace, Defence, Marine Engineering, Instrumentation, Automotive, Industrial Pipe Fittings, Refinery, Chemical Industries, Pharmaceutical, Construction, Paper and Pulp Industries","Open Die Forging, Closed Die Forging, Investment Casting",,,,,,,,,,,,,,,,,,,,,,,,,,,,
260,Simon Steel (India),Mumbai,,,,,,"Chemical Industries, Petrochemical, Refinery, Fertilizers, Power PLant, Nuclear Power, Oil & Gas, Paper, Breweries, Cement, Sugar",Ring Forging,,,,,,,,,,,,,,,,,,,,,,,,,,,,
261,Prayag Precitech,Ahmedabad,,,,,,"Oil & Gas, Valves & Pumps, Food & Beverages, Textile, Medical Equipment, Plastic Machinery, Hose Pipe Manufacturer, General Engineering",CNC Machining,,,,,,,,,,,,,,,,,,,,,,,,,,,,
262,Quality Auto Components Pvt.Ltd.,Pune,,,,,,"Oil & Gas, Dairy, Agriculture, Engineering, Automobile, Printing Machinery",Open Die Forging,,,,,,,,,,,,,,,,,,,,,,,,,,,,
263,Lion Industries,Ludhiana,,,,,,"Automotive, Agricultural Equipment, Lawn & Garden, Fluid Power, Oil & Gas","CNC Machining, Hot Forging",,,,,,,,,,,,,,,,,,,,,,,,,,,,
264,Vipul Brass Industries,Jamnagar,,,,,,"Automotive, Energy, Electronic, Earthing & Grounding, Petroleum, Aerospace, Defence, Marine, Gas, Plumbing, Medical Equipment, Agricultural, Watch, Hardware & Sanitary",,,,,,,,,,,,,,,,,,,,,,,,,,,,,
265,TIRUPATI FORGE LIMITED,Rajkot,,,,,,"Automotive, Oil & Gas, Power, Aerospace, Rail, Marine, Construction & Mining",Ring Forging,,,,,,,,,,,,,,,,,,,,,,,,,,,,
266,G.S.B. FORGE PVT. LTD.,Ranga Reddy,,,,,,"Commercial Vehicles, Diesel Engine, Construction Equipment, Earth Moving, Oil Field, General Engineering",Closed Die Forging,,,,,,,,,,,,,,,,,,,,,,,,,,,,
267,Goodluck Engineering Co.,Ghaziabad,,,,,,"Oil & Gas, Energy & Marine, Defence & Railways, Defence, Railways, Plant & Machinery, Automobile, Construction Equipment, Earth Moving, Fertilizers, General Engineering, Heat Exchanger, Nuclear Power, Petrochemical, Pressure Vessels, Valves, Wind Engergy, Automotive, Aerospace, Defense, Oil & Gas, Railways, Hydraulic Valve, Wind Mill, General Engineering, Construction Equipment, Petrochemical, Fertilizers, Heat Exchanger, Nuclear Power, Pressure Vessel, Thermal Power","Ring Forging, Closed Die Forging",,,,,,,,,,,,,,,,,,,,,,,,,,,,
268,Sivaramakrishna Forgings Pvt Ltd.,Kanchipuram,,,,,,,,,,,,,,,,,,,,,,,,,,,,,,,,,,,
269,SACHIN FORGE,Pune,,,,,,"Oil & Gas, Automotive, Defense",Closed Die Forging,,,,,,,,,,,,,,,,,,,,,,,,,,,,
270,Accurate Steel Forgings (INDIA) Limited,Tiruvallur,,,,,,"Automotive, Valves & Pumps, Hydraulic, Agricultural Equipment, Elevator",Closed Die Forging,,,,,,,,,,,,,,,,,,,,,,,,,,,,
271,RACHAMALLU FORGINGS (P) LTD,Hyderabad,,,,,,"Defence, Aerospace, Power Transmission, Heavy & Medium Engineering",Open Die Forging,,,,,,,,,,,,,,,,,,,,,,,,,,,,
272,Harihar Alloys Private Limited,Tiruchirappalli,,,,,,"Valves, Oil Field, Earth Moving, General Engineering, Railway, Marine Applications, Manifold Fittings, Valves, Oil Field, Earth Moving, General Engineering, Railway, Marine Applications, Manifold Fittings","Sand Casting, Open Die Forging, Closed Die Forging",,,,,,,,,,,,,,,,,,,,,,,,,,,,
273,Birla Precision Technologies Ltd.,"Aurangabad, Nashik",,,,,,,,,,,,,,,,,,,,,,,,,,,,,,,,,,,
274,Magna Industries Foundry Division,Kolhapur,,,,,,"Hydraulic Equipment, Emission Gas Recirculation Systems, Power Transmission, Lifts & Conveyers, Automotive",Shell Moulding,,,,,,,,,,,,,,,,,,,,,,,,,,,,
275,MARSHALL TECHNOCAST PVT. LTD,Rajkot,,,,,,"Valves & Pumps, Food Processing, Material Handing, Defence, Automotive, General Engineering",Investment Casting,,,,,,,,,,,,,,,,,,,,,,,,,,,,
276,METFLOW CAST PVT. LTD,Rajkot,,,,,,"Valves & Pumps, Chemical Processing, Food Processing, Refinery, Mining, Oil Exploration, Marine, Power Generation, Earth Moving, General Engineering","Sand Casting, Investment Casting",,,,,,,,,,,,,,,,,,,,,,,,,,,,
277,PAVAN INDUSTRIES,"Rajkot, Pune",,,,,,"Valves & Pumps, Automotive, Locomotive, Textile, Fire & Safety, Defense, Aerospace, Marine, Construction & Mining, Agricultural Equipment, Earth Moving","Sand Casting, Investment Casting, Injection Molding, Die Casting, Gravity Die Casting, Shell Moulding, Open Die Forging, Closed Die Forging, Ring Forging",,,,,,,,,,,,,,,,,,,,,,,,,,,,
278,POOJA CASTINGS PVT. LTD.,Pune,,,,,,,,,,,,,,,,,,,,,,,,,,,,,,,,,,,
279,Ratnamani Technocast Pvt Ltd,Gandhinagar,,,,,,"Valves & Pumps, Steam Application, Automotive, Defense, Aerospace, Chemical Industries, Food Processing, General Engineering, Valves & Pumps, Steam Application, Automotive, Defense, Aerospace, Chemical Industries, Food Processing, General Engineering","Investment Casting, Investment Casting",,,,,,,,,,,,,,,,,,,,,,,,,,,,
280,Shakuntala Steels,Kolhapur,,,,,,"OEM, Oil & Gas, Power Transmission, Transportation, General Engineering, OEM, Oil & Gas, Power Transmission, Transportation, General Engineering","Sand Casting, Sand Casting",,,,,,,,,,,,,,,,,,,,,,,,,,,,
281,Spin - N - Cast,Pune,,,,,,"Forging, Defense, Marine, Nuclear, Steel, Mining, Transmission, Hydro, Forging, Defense, Marine, Nuclear, Steel, Mining, Transmission, Hydro",Centrifugal Casting,,,,,,,,,,,,,,,,,,,,,,,,,,,,
282,Stable Industries Pvt Ltd,Pimpri-Chinchwad,,,,,,"Automotive, Agricultural Equipment, Construction, Power Transmission, General Engineering, Automotive, Agricultural Equipment, Construction, Power Transmission, General Engineering","Closed Die Forging, Open Die Forging, Closed Die Forging, Open Die Forging",,,,,,,,,,,,,,,,,,,,,,,,,,,,
283,SUJATA FORGE (P) LIMITED,Ranga Reddy,,,,,,"Defence, Mining, Aerospace, Railways, General Engineering, Defence, Mining, Aerospace, Railways, General Engineering","Closed Die Forging, Closed Die Forging",,,,,,,,,,,,,,,,,,,,,,,,,,,,
284,WESTERN INDIA FORGINGS GROUP,Pune,,,,,,"Mining & Drilling, Oil & Gas, Gears & Transmission, Construction, Earth Moving, Railways & Metro, Power Hydro, Automotive, Power & Energy, Pharmaceutical, General Engineering, Material Handing","Closed Die Forging, Open Die Forging, Ring Forging",,,,,,,,,,,,,,,,,,,,,,,,,,,,
285,CHW Forge,Ghaziabad,,,,,,"Defense, Aerospace, Oil & Petrochemical, Material Handing, Earth Moving, Bearing, Fabrication, Wind Engergy, Power & Energy, Valves, Pressure Vessels, Heat Exchanger, EPC Contractors",Ring Forging,,,,,,,,,,,,,,,,,,,,,,,,,,,,
286,VULKAN TECHNOLOGIES PVT. LTD. INDIA,Pirangut,,,,,,"Oil & Gas, Mining, Bulk Material Handling, Iron & Steel, Renewable Energy, General Engineering, Oil & Gas, Mining, Bulk Material Handling, Iron & Steel, Renewable Energy, General Engineering","Sand Casting, Gravity Die Casting, Centrifugal Casting",,,,,,,,,,,,,,,,,,,,,,,,,,,,
287,Steel And Industrial Forgings Limited (SIFL),Minalur,,,,,,"Defence, Aerospace, Oil & Gas, Heavy Fabrication Industries, Earth Moving, Railways, Automobile, Defence, Aerospace, Oil & Gas, Heavy Fabrication Industries, Earth Moving, Railways, Automobile",Closed Die Forging,,,,,,,,,,,,,,,,,,,,,,,,,,,,
288,Norma (India) Limited,Ghaziabad,,,,,,"Defence, Railways, Heavy Fabrication Industries, Oil drill Bits, Diesel Locomotives, Defence, Railways, Heavy Fabrication Industries, Oil drill Bits, Diesel Locomotives",Open Die Forging,,,,,,,,,,,,,,,,,,,,,,,,,,,,
289,Vijayalakshmi forgings,Coimbatore,,,,,,"Automotive, Railways, General Engineering, Valve, RIG, Agriculture, Automotive, Railways, General Engineering, Valve, RIG, Agriculture",Hot Forging,,,,,,,,,,,,,,,,,,,,,,,,,,,,
290,Scorpio Precisions,Kanchipuram,,,,,,"Oil & Gas, Petrochemical, Paper and Pulp Industries, Power Plant, Pharmaceutical, Refineries, Aerospace, Marine, Cement , Valves & Pumps, Chemical Industries, Oil & Gas, Petrochemical, Paper and Pulp Industries, Power Plant, Pharmaceutical, Refineries, Aerospace, Marine, Cement , Valves & Pumps, Chemical Industries","Ring Forging, Ring Forging",,,,,,,,,,,,,,,,,,,,,,,,,,,,
291,Dynamic Group of Companies,Palghar,,,,,,"Oil Field, Oil Field",Closed Die Forging,,,,,,,,,,,,,,,,,,,,,,,,,,,,
292,Elegant Forge & Equipments Pvt Ltd,Thane,,,,,,"Oil & Gas, Railways, Oil & Gas, Railways","Closed Die Forging, Open Die Forging",,,,,,,,,,,,,,,,,,,,,,,,,,,,
293,R.R. FORGINGS PRIVATE LIMITED,Bangalore Urban,,,,,,"Gasket Industries, Valve Industries, Turbine Manufacturing Industries, Oil & Gas, Power Transmission, Earth Moving, Bearing, Pumps Manufacturing Industries, Gasket Industries, Valve Industries, Turbine Manufacturing Industries, Oil & Gas, Power Transmission, Earth Moving, Bearing, Pumps Manufacturing Industries","Ring Forging, Open Die Forging, Ring Forging, Open Die Forging",,,,,,,,,,,,,,,,,,,,,,,,,,,,
294,KAY JAY FORGINGS PVT. LTD,Ludhiana,,,,,,"Automotive, Automotive","Hot Forging, Hot Forging",,,,,,,,,,,,,,,,,,,,,,,,,,,,
295,A. V. STEEL FORGINGS PVT. LTD,Vadodara,,,,,,"Oil & Gas, Railways, Mining, Material Handing, Heavy Fabrication Industries, Oil & Gas, Railways, Mining, Material Handing, Heavy Fabrication Industries",Open Die Forging,,,,,,,,,,,,,,,,,,,,,,,,,,,,
296,ACE FORGE PVT LTD,Bangalore Urban,,,,,,"Automotive, Aerospace, Locomotive, Oil & Gas",Cold Forging,,,,,,,,,,,,,,,,,,,,,,,,,,,,
297,BSP METATECH LLP,Pune,,,,,,"Automotive, Earth Moving, Defense, Railways, Railways & Metro, Electrical","Sheet Metal Stamping, Laser Cutting, Sheet Metal Bending, Welding",,,,,,,,,,,,,,,,,,,,,,,,,,,,
298,Eternal Alloy Cast Pvt. Ltd.,Rajkot,,,,,,"Oil & Gas, Valves & Pumps, Railways & Metro, Automobile & Locomotive, Pharmaceutical, Marine, Medical & Surgical, Defense, Aerospace, Food & Beverages, Agricultural, Hardware &Tools, General Engineering, Cement &Steel Plant, Power PLant, Earth Moving, Mining Industries",Investment Casting,,,,,,,,,,,,,,,,,,,,,,,,,,,,
299,Gnat Foundry Pvt. Ltd,Kolhapur,,,,,,"Railways, Automobile, General Engineering, Railways, Automobile, General Engineering","Sand Casting, Sand Casting",,,,,,,,,,,,,,,,,,,,,,,,,,,,
300,Om Forge,Ahmednagar,,,,,,"Automobile, Electrical, Oil Industries, Heavy Fabrication Industries",Closed Die Forging,,,,,,,,,,,,,,,,,,,,,,,,,,,,
301,Paramount Brass Industries,Jamnagar,,,,,,"Electrical & Electronics, Home Appliances, Medical Equipments, Plastic & Rubber Molding, Gas, Automobile, Aerospace, Hydraulic Hose & Pneumatics, Agricultural Equipment, Water valve & Piping, Sanitary & Plumbing, Electrical & Electronics, Home Appliances, Medical Equipments, Plastic & Rubber Molding, Gas, Automobile, Aerospace, Hydraulic Hose & Pneumatics, Agricultural Equipment, Water valve & Piping, Sanitary & Plumbing",Sand Casting,,,,,,,,,,,,,,,,,,,,,,,,,,,,
302,RAJENDRA ENGINEERING,Coimbatore,,,,,,"Automotive, Transmission, Valves, Automotive, Transmission, Valves","CNC Machining, CNC Machining",,,,,,,,,,,,,,,,,,,,,,,,,,,,
303,Raviraj Metals,Kolhapur,,,,,,,Sand Casting,,,,,,,,,,,,,,,,,,,,,,,,,,,,
304,RUKMANI ENGINEERING WORKS,Coimbatore,,,,,,"Valves & Pumps, Construction, Construction Equipment",Sand Casting,,,,,,,,,,,,,,,,,,,,,,,,,,,,
305,SBS International Pvt. Ltd.,Gurgaon,,,,,,"Automotive, Electrical & Electronics, Home Appliances",Die Casting,,,,,,,,,,,,,,,,,,,,,,,,,,,,
306,Shakti Engineering,Belagavi,,,,,,"Valves & Pumps, Automotive, Oil & Gas",CNC Machining,,,,,,,,,,,,,,,,,,,,,,,,,,,,
307,Adroit Industries(India)Ltd,Indore,,,,,,"Automotive, Defense, Irrigation, Marine, Mining, Metal Processing, Waste Water Management, Railway",,,,,,,,,,,,,,,,,,,,,,,,,,,,,
308,Adroit TechMech Solution,Ahmedabad,,,,,,,,,,,,,,,,,,,,,,,,,,,,,,,,,,,
309,AllTech Metal Cast,Rajkot,,,,,,"Automobile Sector , Agricultural Equipment, Power , Defence, Electrical, Railways, Aerospace, Fire & Safety, General Engineering, Earth Moving, Infrastructure","Sand Casting, Shell Moulding",,,,,,,,,,,,,,,,,,,,,,,,,,,,
310,BHUMI TECHNOCAST PVT LTD,Rajkot,,,,,,"Valves & Pumps, Automotive, Defence, Marine, Aerospace, Agriculture Machinery Parts, Nuclear, Railways, Scaffolding, Mining, Hardware Fitting, Human Implants, Pharmaceutical, General Engineering",Investment Casting,,,,,,,,,,,,,,,,,,,,,,,,,,,,
311,Crescent Foundry,Kolkata,,,,,,"Muncipal, Ring, Heavy CWT, Light CWT, Agriculture Access, Gratings, Railways, Automotive, Industrial, Valves & Pumps, Aerospace",Sand Casting,,,,,,,,,,,,,,,,,,,,,,,,,,,,
312,CUB EXPORTS INTERNATIONAL,Ludhiana,,,,,,,CNC Machining,,,,,,,,,,,,,,,,,,,,,,,,,,,,
313,Hindustan Brass Industries,Jamnagar,,,,,,"Electrical & Electronics, Fluid Power, Instrumentation, Lawn & Garden, Machinery, Molded Inserts, Motion & Control System, Valves & Pumps, Semi-Conductor",CNC Machining,,,,,,,,,,,,,,,,,,,,,,,,,,,,
314,KIRIT INDUSTRIES,Ahmedabad,,,,,,"Oil & Gas, Refineries, Mining, Chemical Industries, Paper and Pulp Industries, Agriculture, Construction Equipment, Textile, Sugar, Chemical",CNC Machining,,,,,,,,,,,,,,,,,,,,,,,,,,,,
315,Pragati technologies,Ahmedabad,,,,,,"Electronic, Medical, Aerospace, Automobile, Pharmaceutical",CNC Machining,,,,,,,,,,,,,,,,,,,,,,,,,,,,
316,Rajeshwary Technocast Pvt. Ltd.,Rajkot,,,,,,,Sand Casting,,,,,,,,,,,,,,,,,,,,,,,,,,,,
317,Research Development & Manufacturing Corporation,Bangalore Urban,,,,,,"Locomotive, Earth Moving, Off-Highway Equipment, Industrial Gear Boxes, Mining, Stone crushers, Marine, Winches, Cranes, Defence, Windmill, Aerospace, Textile & Printing Machines",CNC Machining,,,,,,,,,,,,,,,,,,,,,,,,,,,,
318,SAN Precision Alloys Private Limited,Coimbatore,,,,,,"Automotive, Valves & Pumps, Earth Moving, Power , Wind Engergy, Aerospace, Defense, General Engineering",Investment Casting,,,,,,,,,,,,,,,,,,,,,,,,,,,,
319,SHARP CHUCKS AND MACHINES PRIVATE LIMITED,Jalandhar,,,,,,"Automotive, Earth Moving, Railways, Defense",Sand Casting,,,,,,,,,,,,,,,,,,,,,,,,,,,,
320,SUNTECH INDUSTRIES,Rajkot,,,,,,Valves & Pumps,CNC Machining,,,,,,,,,,,,,,,,,,,,,,,,,,,,
321,Trident Steels,Belagavi,,,,,,"Valves & Pumps, Biomedical Implants, Prosthetics, General Engineering",Investment Casting,,,,,,,,,,,,,,,,,,,,,,,,,,,,
322,VANSA DIE CASTINGS PVT LTD,"Bangalore Urban, Bangalore Urban",,,,,,"Automotive, Hydraulic Pumps, Electronic / Electric, Domestic Appliances",Die Casting,,,,,,,,,,,,,,,,,,,,,,,,,,,,
323,FINETURN,Faridabad,,,,,,"Automotive & Tractor, Defense, AC, Camera Industry","Die Casting, Cold Forging",,,,,,,,,,,,,,,,,,,,,,,,,,,,
324,INVENT CAST PVT LTD,Rajkot,,,,,,"Valves & Pumps, Automotive","Investment Casting, Investment Casting",,,,,,,,,,,,,,,,,,,,,,,,,,,,
325,Aakar Foundry Private Limited,Pune,,,,,,"Automotive, Non Automotive","Gravity Die Casting, Die Casting",,,,,,,,,,,,,,,,,,,,,,,,,,,,
326,Alka Forgings,Ghaziabad,,,,,,"Defence, Aerospace, Nuclear, Oil & Gas, Gear Manufacturing, Pressure Vessels, Power Generation, Valves & Pumps, Material Handing, Earth Moving","Open Die Forging, Ring Forging",,,,,,,,,,,,,,,,,,,,,,,,,,,,
327,Adma Auto Components Pvt Ltd,Mysuru,,,,,,,,,,,,,,,,,,,,,,,,,,,,,,,,,,,
328,Alphacraft,Coimbatore,,,,,,"Automotive, Electronics, Telecommunication, Farm Equipment","Die Casting, Gravity Die Casting",,,,,,,,,,,,,,,,,,,,,,,,,,,,
329,Balu Forge,"Belagavi, Mumbai Suburban",,,,,,"Railways, Defence, Oil & Gas, Agriculture, E-mobility, Gensets, Automotive, Refrigeration, Pumps",Closed Die Forging,,,,,,,,,,,,,,,,,,,,,,,,,,,,
330,Dhanada Engineering,Kolhapur,,,,,,"Valves & Pumps, Automotive",CNC Machining,,,,,,,,,,,,,,,,,,,,,,,,,,,,
