,Company Information,,,,,,,Services,,,Quality,,,,Facility,,,,,,,,,,,,,Users,,,,,,,,Upload feature - Documents,
142,Ganesh Metal Works,"143/1, 9th Main Rd, Duggalamma Layout, UBMEC Layout, Peenya III Phase, Peenya, Bengaluru, Karnataka 560058, India",https://www.gmw.co.in/,NA,NA,NA,NA,,CNC Machining,NA,,,NA,NA,NA,NA,NA,NA,NA,NA,NA,NA,NA,NA,NA,NA,NA,,,,,,,,,,
143,Sri Garuda Machining Works,"4524+MFG, Ksr Nagar, Ambattur, Chennai, Tamil Nadu 600053, India",http://www.garudamachiningworks.in/,NA,NA,NA,NA,,CNC Machining,NA,,,NA,NA,NA,NA,NA,NA,NA,NA,NA,NA,NA,NA,NA,NA,NA,,,,,,,,,,
144,Trimurti Enterprises,"Plot 38, Sector No 10, PCNTDA, Behide Times of India Press, J Block, Sector 10, MIDC, Bhosari, Pune, Maharashtra 411026, India",https://trimurti-enterprises.com/,NA,NA,NA,NA,,CNC Machining,NA,,,NA,NA,NA,NA,NA,NA,NA,NA,NA,NA,NA,NA,NA,NA,NA,,,,,,,,,,
145,Sri ShriJayaveeraa Enterprises,"10/13, 1st cross street, Narasingapuram, Maduvangarai, Chakrapani Rd, Old Narasingapuram, Race View Colony, Guindy, Chennai, Tamil Nadu 600032, India",http://shrijayaveeraa.com/,NA,NA,NA,NA,,CNC Machining,NA,,,NA,NA,NA,NA,NA,NA,NA,NA,NA,NA,NA,NA,NA,NA,NA,,,,,,,,,,
146,Neepuna Manufacturing Solutions Pvt Ltd,"#53, Kachohalli Industrial Main Road, Bylakonehalli, near Sai Baba Temple, Bengaluru, Karnataka 560091, India",http://neepunamanufacturing.com/,NA,NA,NA,NA,,CNC Machining,NA,,,NA,NA,NA,NA,NA,NA,NA,NA,NA,NA,NA,NA,NA,NA,NA,,,,,,,,,,
147,Sapthagiri Aerospace & Defence Pvt Ltd,"#939 Kempegowda Indl. Estate, Magadi Main Rd, Sannakki Bayalu, Kullegowda Industrial Estate, Kamakshipalya, Bengaluru, Karnataka 560079, India",http://www.sapaero.in/,NA,NA,NA,NA,,CNC Machining,NA,,,NA,NA,NA,NA,NA,NA,NA,NA,NA,NA,NA,NA,NA,NA,NA,,,,,,,,,,
148,Astron brass components,"ASTRON BRASS COMPONENTS Plot No.4092, â€˜Iâ€™ Road, GIDC Phase III, GIDC Phase-2, Dared, Jamnagar, Gujarat 361004, India",http://astronbrass.com/,NA,NA,NA,NA,,CNC Machining,CNC Machining: Brass,,,NA,NA,NA,NA,NA,NA,NA,NA,NA,NA,NA,NA,NA,NA,NA,,,,,,,,,,
149,Techno Precision manufacturing,NA,,NA,NA,NA,NA,,CNC Machining,NA,,,NA,NA,NA,NA,NA,NA,NA,NA,NA,NA,NA,NA,NA,NA,NA,,,,,,,,,,
150,Saroj Engineering,NA,,NA,NA,NA,NA,,CNC Machining,NA,,,NA,NA,NA,NA,NA,NA,NA,NA,NA,NA,NA,NA,NA,NA,NA,,,,,,,,,,
151,Team -D Technologies,"no 56/1 , kottigepalya , magadi main road, opposite : Indian Instute of Unani Medicine, Kottigepalya, Bengaluru, Karnataka 560091, India",http://www.teamd.in/,NA,NA,NA,NA,,CNC Machining,NA,,,NA,NA,NA,NA,NA,NA,NA,NA,NA,NA,NA,NA,NA,NA,NA,,,,,,,,,,
152,Enplasin,"86, Jigani Industrial Area, Vaddarapalya, Bengaluru, Karnataka 562106, India",https://www.enplas.co.jp/,NA,NA,NA,NA,,CNC Machining,CNC Machining: Plastics,,,NA,NA,NA,NA,NA,NA,NA,NA,NA,NA,NA,NA,NA,NA,NA,,,,,,,,,,
153,Vieng Manufacturing Sytems,"No 510, 4th Cross, 10th Main Road, 4th Phase, Maruthi Nagar, Peenya, Bengaluru, Karnataka 560058, India",,NA,NA,NA,NA,,CNC Machining,NA,,,NA,NA,NA,NA,NA,NA,NA,NA,NA,NA,NA,NA,NA,NA,NA,,,,,,,,,,
154,Lion Industries,"Lion Estate, 4, Samrat Industrial Area, Gondal Road, Samrat Industrial Area, Panchsheel Park, Samrat Industrial Area, Rajkot, Gujarat 360004, India",https://www.lionindustries.co.in/,NA,NA,NA,NA,"Automotive,Machinery & Equipments",CNC Machining,"CNC Machining: Plain Carbon and Low Alloy Steels,CNC Machining: Stainless Steels,CNC Machining: Brass,CNC Machining: Copper,CNC Machining: Mild Steel",ISO 9001,Manual,NA,NA,NA,NA,NA,NA,NA,NA,NA,NA,NA,NA,NA,NA,NA,RAJA,VICE PRESIDENT,,9888214005,,,,,,
155,Numann Industries,"63/A, SIPCOT Industrial Complex, Sipcot Ph. I, Hosur, Tamil Nadu 635126, India",https://www.numannauto.com/,919360078778,NA,NA,NA,,CNC Machining,"CNC Machining: Plain Carbon and Low Alloy Steels,CNC Machining: Stainless Steels,CNC Machining: Aluminium Alloys,CNC Machining: Brass,CNC Machining: Mild Steel,CNC Machining: Copper","ISO 9001,IATF 16949","Manual,Profile Projector,CMM",NA,NA,NA,NA,NA,NA,NA,NA,NA,NA,NA,NA,NA,NA,NA,Ravindran,Proprietor,ravi@numannauto.com,9360078778,,,"npd@numannauto.com , info@numannauto.com",,,
156,Shakthi Tech Manufacturing India Private Ltd,"542, 4A, Main Road, Saravanampatti, Vellakinar, Tamil Nadu 641029, India",,919442649550,NA,NA,NA,"Automotive,Defense,Machinery & Equipments,Oil & Gas,Electrical & Electronics",Casting,Casting: Aluminium,ISO 9001,Manual,NA,NA,NA,NA,NA,NA,NA,NA,NA,NA,NA,NA,NA,NA,NA,ANGOU,,m_angou@shakthicastings.com,9442649550,,,,,,
157,Champion Extrusions,"#A-21, Peenya 3rd Stage,, Peenya Industrial Area, 3rd Stage, Maruthi Nagar, Peenya, Bengaluru, Karnataka 560058, India",https://www.championextrusions.com/,9108933585,NA,NA,NA,"Automotive,Machinery & Equipments,Electrical & Electronics",Forging,Forging: Plain Carbon and Low Alloy Steels,,Manual,NA,NA,NA,NA,NA,NA,NA,NA,NA,NA,NA,NA,NA,NA,NA,Darshan,,darshan@championextrusions.com,9108933585,,,,,,
158,Veer O Metals Private Limited,"No: A-02, BEL Industrial Estate, Sundara Nagar, Gokula Extension, Jalahalli, Bengaluru, Karnataka 560013, India",https://www.veerometals.in/,918023712195,NA,NA,NA,"Automotive,Aerospace,Machinery & Equipments,Electrical & Electronics","CNC Machining,Laser Cutting,Welding,Others","CNC Machining: Plain Carbon and Low Alloy Steels,CNC Machining: Stainless Steels,Laser Cutting: Aluminium",ISO 9001,Manual,NA,NA,NA,NA,NA,NA,NA,NA,NA,NA,NA,NA,NA,NA,NA,Vaneet,Director,vaneetss@veerometals.com,8023712195,,,,,,
159,Accutech Laser PVT LTD,"484/A1, 13th Cross Rd, Peenya Industrial Area Phase IV, Peenya, Bengaluru, Karnataka 560058, India",http://www.accutechlaser.in/,919170196263,NA,NA,NA,"Automotive,Machinery & Equipments,Consumer Goods,Healthcare,Steel","Laser Cutting,Welding",Laser Cutting: Steel,ISO 9001,Manual,NA,NA,NA,NA,NA,NA,NA,NA,NA,NA,NA,NA,NA,NA,NA,Prashant,,info@accutechlaser.in,,Mahesh,,mahesh@accutechlaser.in,7259886531,,
160,Spectrum Tools and Engineering pvt ltd,"97/100, Magadi Main Rd, Govindaraja Nagar Ward, Pete Channappa Industrial Estate, Kamakshipalya, Bengaluru, Karnataka 560079, India",http://www.spectrummoulds.com/,919198451345,NA,NA,NA,"Automotive,Consumer Goods,Electrical & Electronics,Hardware Startups",Injection Molding,Injection Molding: Plastic,ISO 9001,Manual,NA,NA,NA,NA,NA,NA,NA,NA,NA,NA,NA,NA,NA,NA,NA,Sudarshan,Director,sudarshan@spectrummoulds.com,9845134512,,,,,,
161,Swathi Tools & Components,"1, Magadi Main Rd, Govindaraja Nagar Ward, Stage 1, Vijayanagar, Bengaluru, Karnataka 560079, India",https://www.swatiprecision.com/,919190083544,NA,NA,NA,"Electrical & Electronics,Consumer Goods,Automotive",Injection Molding,Injection Molding: Plastic,,Manual,NA,NA,NA,NA,NA,NA,NA,NA,NA,NA,NA,NA,NA,NA,NA,Gangappa,,swathi_tools@yahoo.co.in,9008354488,,,,,,
162,Shree Sampath Plastics,"77, 1, 4th Main Rd, Raghavendra Layout, Someshwara Layout, Hulimavu, Bengaluru, Karnataka 560076, India",https://www.shreesampathplast.com/,918029910477,NA,NA,NA,"Electrical & Electronics,Consumer Goods",Injection Molding,Injection Molding: Plastic,,Manual,NA,NA,NA,NA,NA,NA,NA,NA,NA,NA,NA,NA,NA,NA,NA,,,manager@shreesampathplast.com,8029910477,,,,,,
163,Anjana Enterprises,"Kengeri Main Rd, Papreddy Palya, 2nd Stage, Naagarabhaavi, Bengaluru, Karnataka 560072, India",https://www.indiamart.com/anjanaenterprises/,919535577601,NA,NA,NA,"Automotive,Consumer Goods",Injection Molding,Injection Molding: Plastic,,,NA,NA,NA,NA,NA,NA,NA,NA,NA,NA,NA,NA,NA,NA,NA,Kumar,,anjanaenterprises@ymail.com,9535577601,,,,,,
164,Macpro Technologies,"10/1A hoodi Graphite india Ltd road, hobli, KEB Colony, Industrial Area, Krishnarajapura, Bengaluru, Karnataka 560048, India",https://macpro-technologies.com/,919845655189,NA,NA,NA,"Automotive,Consumer Goods,Hardware Startups,Electrical & Electronics",Injection Molding,Injection Molding: Plastic,ISO 9001,Manual,NA,NA,NA,NA,NA,NA,NA,NA,NA,NA,NA,NA,NA,NA,NA,,,,,,,,,,
165,Vision Tec.,"Shed No.6, 4th Phase, 2nd Stage, Kempaiah Garden,, Peenya Industrial Area,, Gruhalakshmi Housing Colony, Peenya, Bengaluru, Karnataka 560058, India",http://www.visiontec.in/,919886750694,NA,NA,NA,Machinery & Equipments,"Injection Molding,CNC Machining","CNC Machining: Plain Carbon and Low Alloy Steels,CNC Machining: Stainless Steels,CNC Machining: Aluminium Alloys,CNC Machining: Mild Steel",,Manual,NA,NA,NA,NA,NA,NA,NA,NA,NA,NA,NA,NA,NA,NA,NA,,,info@visiontec.in,9886750694,,,,,,
166,Aeon Telectronics Pvt Ltd,"VHV8+H7J, Jayachamarajendra Industrial Estate, Kumaraswamy Layout, Bengaluru, Karnataka 560078, India",http://www.aeontele.com/,919180268617,NA,NA,NA,"Electrical & Electronics,Consumer Goods",Injection Molding,Injection Molding: Plastic,ISO 9001,Manual,NA,NA,NA,NA,NA,NA,NA,NA,NA,NA,NA,NA,NA,NA,NA,,,info@aeontele.com,8026861799,,,,,,
167,Electroplasts Private limited,"#63, Ganganna Layout, Jattipalya Road, Channenhalli, Magadi Road, Bengaluru, Karnataka 562130, India",https://electroplasts.com/,919742271128,NA,NA,NA,"Automotive,Consumer Goods,Electrical & Electronics,Hardware Startups",Injection Molding,Injection Molding: Plastic,ISO 9001,Manual,NA,NA,NA,NA,NA,NA,NA,NA,NA,NA,NA,NA,NA,NA,NA,Sadanand HG,,support@electroplasts.com,9742271128,,,,,,
168,AMS Technologies,"Bengaluru - Mangaluru Hwy, Peenya II Phase, Peenya, Bengaluru, Karnataka 560058, India",http://amstechno.co.in/,919740241016,NA,NA,NA,"Automotive,Electrical & Electronics,Consumer Goods",Injection Molding,Injection Molding: Plastic,ISO 9001,Manual,NA,NA,NA,NA,NA,NA,NA,NA,NA,NA,NA,NA,NA,NA,NA,,,amstech2014@gmail.com,9740241016,,,,,,
169,Micro Moulds & Plastics,"Plot No.327, 328, 338 & 339 Kayarambedu, 603202, Rajarathinam St, Brindavan Colony, Ullagaram, Chennai, Tamil Nadu 603202, India",,NA,NA,NA,NA,Machinery & Equipments,"Injection Molding,CNC Machining","CNC Machining: Stainless Steels,CNC Machining: Plain Carbon and Low Alloy Steels,CNC Machining: Mild Steel",,Manual,NA,NA,NA,NA,NA,NA,NA,NA,NA,NA,NA,NA,NA,NA,NA,,,mmp2407@gmail.com,,,,,,,
170,Kanoria Plastchem Ltd,"Hebbagodi, 121A, Bommasandra Industrial Area, Bengaluru, Karnataka 560099, India",http://www.kplindia.com/,918043770365,NA,NA,NA,"Automotive,Consumer Goods,Electrical & Electronics",Injection Molding,Injection Molding: Plastic,ISO 9001,Manual,NA,NA,NA,NA,NA,NA,NA,NA,NA,NA,NA,NA,NA,NA,NA,,,contact@kplindia.in,8043770365,,,,,,
171,Fortune Plastech,"560049, Bhattarahalli, Hosabasavanapura, Krishnarajapura, Bengaluru, Karnataka 560049, India",http://www.fortuneplastech.com/,NA,NA,NA,NA,"Automotive,Electrical & Electronics,Consumer Goods,Healthcare",Injection Molding,Injection Molding: Plastic,ISO 9001,Manual,NA,NA,NA,NA,NA,NA,NA,NA,NA,NA,NA,NA,NA,NA,NA,,,fortuneplastech@gmail.com,9845213046,,,,,,
172,Majestic Polymers,"Plot No. 39/A, 5th Cross Road, Bommasandra Industrial Area, Bengaluru, Karnataka 560099, India",http://www.majesticpolymers.com/contact.html,919066357339,NA,NA,NA,"Automotive,Consumer Goods,Healthcare",Injection Molding,Injection Molding: Plastic,ISO 9001,Manual,NA,NA,NA,NA,NA,NA,NA,NA,NA,NA,NA,NA,NA,NA,NA,Mamalaivasan,,mamalaivasanc@majesticpolymers.com,9066357339,,,,,,
173,Komtech Plastic,"2GFC+M54, Phase 3, Peenya, Bengaluru, Karnataka 560058, India",http://komtechindia.com/,919591998572,NA,NA,NA,"Automotive,Consumer Goods,Healthcare,Electrical & Electronics",Injection Molding,NA,ISO 9001,Manual,NA,NA,NA,NA,NA,NA,NA,NA,NA,NA,NA,NA,NA,NA,NA,Sreenivas,Head Operations,pushparaj@komtechindia.com,9591998572,,,,,,
174,Techno Science Industries,"S.F, NO 1167, 2B, Alasanatham Rd, Venkatesh nagar, Hosur, Tamil Nadu 635109, India",https://techno-science-industries.business.site/,919489580565,NA,NA,NA,"Automotive,Consumer Goods",Injection Molding,Injection Molding: Plastic,,Manual,NA,NA,NA,NA,NA,NA,NA,NA,NA,NA,NA,NA,NA,NA,NA,Vasu,Founder,technoscienceindustries@gmail.com,9489580565,,,,,,
175,Excel springs,"Plot No. Q-1, KSSIDC Industrial Area, Veerasandra, Huskur Road, off, Phase 2, Hosur Rd, Shanthi Pura, Electronic City Phase II, Electronic City, Bengaluru, Karnataka 560100, India",http://excelsprings.in/,NA,NA,NA,NA,"Automotive,Aerospace,Defense,Machinery & Equipments,Healthcare,Electrical & Electronics",Spring Manufacturing,Spring Manufacturing: Stainless Steels,ISO 9001,Manual,NA,NA,NA,NA,NA,NA,NA,NA,NA,NA,NA,NA,NA,NA,NA,Manohar,Founder,,9343036758,,,,,,
176,OMNI FORGINGS ( RAJKOT ) PVT. LTD.,"SIDC Rd, Veraval, Gujarat 360024, India",https://omniforgings.com/,912827252365,"Kach Motors Pvt. Ltd., Applied Auto Parts Pvt. Ltd., Volvo Eicher Commercial Vehicle Ltd., Amul Industries Pvt. Ltd., P.M.Diesels Ltd., Hilti Manu. India Pvt. Ltd.",India,INR 800 L,"Automotive,Defense,Machinery & Equipments,Steel,Oil & Gas,Consumer Goods,Hardware Startups,Railways",Hot Forging,NA,ISO 9001,"Manual,Hardness Tester",NA,NA,NA,Yes,Yes,Yes,400,70,8,3,6,NA,NA,NA,NA,Bhovanbhai,MD,omniforg@gmail.com,9327519672,,,,,,
177,Elcoats & Allied Industries,"Vaddarapalya, Bengaluru, Karnataka 560105, India",https://elcoats.com/,918951791222,NA,NA,NA,"Automotive,Aerospace,Defense,Machinery & Equipments,Electrical & Electronics",Post Processing,NA,ISO 9001,Manual,NA,NA,NA,NA,NA,NA,NA,NA,NA,NA,NA,NA,NA,NA,NA,Nikhil,,Nikhil@elcoats.com,8951791222,,,,,,
178,Bharath Electrochem,"128, 4th Main Rd, Rajaji Nagar Industrial Town, Rajajinagar, Bengaluru, Karnataka 560010, India",https://bharathelectrochem.com/,918792244445,NA,NA,NA,"Automotive,Aerospace,Defense,Machinery & Equipments,Steel,Electrical & Electronics",Post Processing,NA,ISO 9001,Manual,NA,NA,NA,NA,NA,NA,NA,NA,NA,NA,NA,NA,NA,NA,NA,Shaan,CEO,info@bharathelectrochem.com,8792244445,,,,,,
179,KALYANI STAMPINGS PRIVATE LIMITED,"2/99 , Perinjambakkam Main Road, Rajiv Gandhi 1st Main Road, 169 , Koolangal Cherry Village, Alagoor,Sriperumbudur, Chennai, Tamil Nadu 601205, India",www.kalyanistampings.com,919840349875,NA,India,NA,"Automotive,Aerospace,Defense,Machinery & Equipments,Steel,Oil & Gas,Consumer Goods,Healthcare,Robotics,Hardware Startups,Electrical & Electronics","Sheet Metal Stamping,Welding,Sheet Metal Bending,Sheet Metal Fabrication",NA,"IATF 16949:2016,ISO 9001",Manual,NA,NA,"58,000 sq ft",Yes,Yes,Yes,NA,70,8,3,6,NA,95 Employees Total,NA,NA,Radhakrishnan,Managing Director,ceo@kalyanistampings.com,9840349875,,,,,,
180,NECCO TOOLS,"No. 9, 1st Street, Loganathan Nagar, Choolaimedu, Kamarajar Nagar, Veerapandi Nagar, Choolaimedu, Chennai, Tamil Nadu 600094, India",http://www.neccotools.com/,910442250091,AUTO-ELECTRICAL INDUSTRY âž¢ M/s Lucas TVS Ltd. âž¢ M/s INDRAD Auto Components Ltd. âž¢ M/s Comstar Automotive âž¢ M/s Johnson Electric âž¢ M/s IJL Pvt Ltd âž¢ M/s Valeo âž¢ M/s Bosch âž¢ M/s Yahama Motors and electricals âž¢ M/s Letrika Roots Ltd ELECTRICAL INDUSTRY( Non Automotive) âž¢ M/s GE India Industrial Pvt. Ltd. âž¢ M/s Areva Ltd. âž¢ M/s Schneider Electric Ltd.,"India, etc",795 L INR,"Automotive,Aerospace,Defense,Machinery & Equipments,Steel,Oil & Gas,Consumer Goods,Healthcare,Hardware Startups,Robotics,Electrical & Electronics","CNC Machining,Sheet Metal Stamping,Welding,Sheet Metal Fabrication,Sheet Metal Bending","CNC Machining: Plain Carbon and Low Alloy Steels,CNC Machining: Stainless Steels,CNC Machining: Aluminium Alloys,CNC Machining: Brass,CNC Machining: Titanium,CNC Machining: Mild Steel,CNC Machining: Copper,CNC Machining: Plastics",ISO/TS 16949,"CMM,Manual",NA,NA,6 Units in chennai,Yes,Yes,Yes,NA,70,8,3,6,NA,NA,NA,NA,Paul,GM,paul@neccotools.com,9381749925,,,,,,
181,PRECISE TECHNOCAST PVT. LTD.,"PLOT NO. G-1931, B/H ALMIGHTY AGRO PRODUCT, ALMIGHTY GATE, METODA TA: LODHIKA, DIST:, GIDC, Rajkot, Gujarat 360021, India",www.precisetechnocast.com,910282728750,NA,Germany France Greece USA Czech Republic UAE Canada Taiwan,NA,"Automotive,Defense,Machinery & Equipments,Steel,Oil & Gas,Consumer Goods,Robotics,Hardware Startups",Investment Casting,NA,ISO 9001,Manual,NA,NA,NA,Yes,Yes,Yes,110,70,8,3,6,NA,NA,NA,NA,Dharmesh,Director,info@precisetechnocast.com,9099917765,,,precisetechno@yahoo.com,,,
182,Amtech Investment Casting Private Limited.,"Survey No. 238, Behind Vikas Exports Gondal Road, Village-, Kothariya, Rajkot, Gujarat 360002, India",http://www.amtechcast.com/,919726895768,NA,US UK Germany France Italy Portugal Spain Argentina Belgium Australia Japan Mexico,180 mil INR,"Automotive,Aerospace,Defense,Machinery & Equipments,Steel,Oil & Gas,Healthcare,Robotics,Consumer Goods,Hardware Startups,Electrical & Electronics","Investment Casting,Gravity Die Casting",NA,ISO 9000,Manual,NA,NA,NA,Yes,Yes,Yes,180,60,8,3,6,Yes,NA,NA,NA,Harsh,Marketing Head,harsh@amtechcast.com,9726895768,,,,,,
183,SAI SPRINGS,"Sai Springs, No. 270/1, Bhaanu Nursing Home Road, Bommanahalli, Bengaluru, Karnataka 560068, India",http://www.saisprings.in/,919008004409,NA,India,40 Mil INR,"Automotive,Aerospace,Defense,Machinery & Equipments,Steel,Oil & Gas,Consumer Goods,Healthcare,Robotics,Hardware Startups,Electrical & Electronics",Spring Manufacturing,Spring Manufacturing: Stainless Steels,ISO 9001,Manual,NA,NA,8040 sqft,Yes,Yes,Yes,NA,70,NA,NA,NA,NA,"12 Unskilled, 12 Skilled & 6 Staffs",NA,NA,MOHAN,Director,mohanbabu@saisprings.in,9008004409,,,,,,
184,Bangalore spring Industries,"No 1/1 Roshanbaugh Road Next left cross to Nandhini hotel, Parvathipuram, Vishweshwarapura, Basavanagudi, Bengaluru, Karnataka 560004, India",http://www.bangaloresprings.com/,919341908680,Bosch group of companies Amphinol Bill forge JSW steel limited BEML L&T Proman Infrastructure HAL Havells India Tenova Delkor India Jindal power and steel Ltd Sansera Engineering Mahindra CIE ( Bill Forge) Nextfirst Engineering Amphinol engineering,India,NA,"Automotive,Aerospace,Defense,Machinery & Equipments,Steel,Oil & Gas,Healthcare,Consumer Goods,Robotics,Hardware Startups,Electrical & Electronics",Spring Manufacturing,Spring Manufacturing: Stainless Steels,ISO 9001,Manual,NA,NA,NA,Yes,Yes,Yes,NA,70,NA,NA,NA,NA,NA,NA,NA,Sandeep,MD,info@bangaloresprings.com,9986649272,,,,,,
185,TAYSONS INDUSTRIES PVT LTD,"Block No. D-13, MIDC Industrial Area, Miraj, Maharashtra 416410, India",http://www.taysonsindustries.com/,918459614102,,,,"Automotive,Defense,Machinery & Equipments,Steel,Oil & Gas,Consumer Goods,Railways,Hardware Startups",Sand Casting,NA,ISO 9001,Manual,NA,NA,,,,,,,,,,,,,,Heman,Executive Director,heman.taysheti@taysonsindustries.com,9423872360,Vijay,Markting Rep,development@taysonsindustries.com,8459614102,,
186,Emerson Forge Pvt Ltd,"Survey No. 269, P1/P2,, Shapar (Veraval), Dist. Rajkot, Gujrat (India), Shapar, Gujarat 360024, India",https://www.emersonforge.in/,919825171101,Domestic Customer â€¢ Dy Power India Pvt Ltd â€¢ Tirth Agro Technology Pvt Ltd Shaktiman â€¢ Jost India Auto Components Pvt Ltd â€¢ Dantal Hydraulics Pvt Ltd â€¢ Mosdorfer India Pvt Ltd â€¢ PMP Drive System India Pvt Ltd â€¢ Sanjeev Auto Part Manufacturers Pvt.Ltd. â€¢ Rothe Erde India Pvt Ltd Thyssenkrupp Group âž¢ List Of Customer Overseas Customer â€¢ Alo AB - Sweden â€¢ Fahrzeugwerk B. Krone GmbH & Co â€“ Germany â€¢ Bailey Manufacturing LP â€“ USA â€¢ Kee Safety Far East Limited â€“ UK â€¢ Gunderson Inc â€“ USA â€¢ Motovario SPA â€“ Italy â€¢ Hema EndÃ¼stri - Turkey,"India, Sweden, Germany, USA, UK, Turkey, Italy",4000 Lac INR,"Automotive,Defense,Machinery & Equipments,Steel,Oil & Gas,Consumer Goods,Robotics,Hardware Startups,Railways","Hot Forging,CNC Machining",NA,"ISO 9001,IATF 16949","Manual,Hardness Tester",NA,NA,5059 Sqm,Yes,Yes,Yes,600,60,8,3,6,Yes,90+ Employees,NA,NA,Rakesh,Marketing Manager,info@emersonforge.in,9825171101,,,,,,
187,Sneha Springs Industries,"Pai Layout, Hulimavu, Bengaluru, Karnataka 560076, India",https://www.snehasprings.com/,918867744461,"Teknic Elecromeconics Pvt Ltd., Lee spring Pvt Ltd VR Engineering Excel Metals VEM Technologies Pvt Ltd., EMKA Panel Accessories AO SMITH Adarsh Engineering Neoteric Precitech Pvt Ltd., FAB RITE Engineering Prashant Gamatex Pvt Ltd.,",India,NA,"Automotive,Machinery & Equipments,Steel,Oil & Gas,Consumer Goods,Robotics,Hardware Startups,Electrical & Electronics",Spring Manufacturing,Spring Manufacturing: Stainless Steels,ISO 9001,Manual,NA,NA,NA,Yes,Yes,Yes,NA,70,NA,NA,NA,NA,NA,NA,NA,,,,,,,,,,
188,Ghanshyam Industries,"Virani Aghat Plot No. 61, Dhebar Road South, Pragati, Society Main Rd, Kotharoya, Bhakti Nagar, Rajkot, Gujarat 360002, India",www.ghanshyamindustries.com,919128825609,NA,"USA, Germany, UK, Poland, Australia, Denmark, Netherland, France and many more",7 Cr,"Automotive,Aerospace,Defense,Machinery & Equipments,Steel,Oil & Gas,Consumer Goods,Healthcare,Robotics,Hardware Startups,Electrical & Electronics",CNC Machining,"CNC Machining: Brass,CNC Machining: Copper",ISO 9001,Manual,"1. Quality Policy 2. Quality Objectives 3. Responsibilities 4. Customer Feedback 5. Information to external providers 6. Product Information 7. Inquiry, Order, Amendments 8. Action taken for customer complaints",5S,"10,000 sq ft",Yes,Yes,Yes,NA,70,8,2,6,NA,25,4,2,Chirag,Head – Business Operations,chirag@ghanshyamindustries.com,9962749984,,,,,,
189,Peenya Fine Comp,"No 47-55/9-13, 13th A cross Raghavendra Industrial Estate, Karihobanahalli, Thigalarapalya Main Rd, near Shiva Bar, Annapurneshwari Nagar, Vaddarapalya, Ragavendra Industrial Estate, Bengaluru, Karnataka 560058, India",www.peenyafinecomp.co.in,918028360139,"Whirlpool, SKF, Saint-Gobain, GE, etc.",India,NA,"Automotive,Defense,Machinery & Equipments,Steel,Oil & Gas,Consumer Goods,Healthcare,Robotics,Hardware Startups,Electrical & Electronics,Aerospace","Sheet Metal Stamping,Welding",NA,"ISO 9001,ISO 15085-1",Manual,NA,"5S, Kaizen",NA,Yes,Yes,Yes,400,70,8,3,6,NA,150+ Employees,NA,NA,Asim,Director-Operations,asim.waheed@peenyafinecomp.co.in,9916364601,,,,,,
190,CHOUGULE INDUSTRIES,"F-6, M I D C, Shiroli, Shiroli, MIDC, Kolhapur, Maharashtra 416122, India",https://www.chouguleindustries.com,910230246871,"Gammon India group ( Freyssinet), Strong Force & Dynamic prestress Construction / Infrastructure industries as well as INDIAN RAILWAYS / TAFE Mahindra and Export .to UK and other European Countries.","India, Europe, Etc",NA,"Automotive,Defense,Machinery & Equipments,Steel,Oil & Gas,Consumer Goods,Railways","Sand Casting,CNC Machining",NA,ISO 9001,"Manual,CMM",NA,"5 S, 3M,TPM","60,000 sq ft",Yes,Yes,Yes,600,60,8,3,6,Yes,NA,NA,NA,Mantosh,Marketing Rrp,amtiwari@chouguleindustries.com,9370770794,,,,,,
191,Nivic Technocast,"Survey No.171/1, Plot No.15 & 16, Shapar, Rajkot, SIDC Rd, Near Santidham Society, Veraval, Gujarat 360024, India",https://nivictechnocast.com/,912827252604,NA,USA UK Canada Netherland Malaysia UAE Denmark Finland Australia Germany Switzerland Italy France Spain Japan Turkey Brazil Mexico Norway Poland,NA,"Automotive,Aerospace,Defense,Machinery & Equipments,Steel,Oil & Gas,Healthcare,Consumer Goods,Robotics,Hardware Startups,Electrical & Electronics",Investment Casting,NA,"ISO 9001,IATF 16949","Manual,Profile Projector,Hardness Tester,Roughness Tester,VMS",NA,NA,2600 Sq. Meters,Yes,Yes,Yes,100,60,8,2,6,Yes,NA,NA,NA,Jagdish,Marketing Manager,jagdish@nivictechnocast.com,9825923725,,,,,,
192,Yashoda Iron Industries,"2/3, M I D C, Shiroli, Shiroli, MIDC, Kolhapur, Maharashtra 416122, India",www.yashodairon.com,912302468709,NA,NA,NA,"Automotive,Defense,Machinery & Equipments,Steel,Oil & Gas,Consumer Goods,Railways,Hardware Startups","Sand Casting,CNC Machining",NA,ISO 9001,Manual,NA,NA,NA,NA,NA,NA,NA,NA,NA,NA,NA,NA,NA,NA,NA,,,,,,,,,,
193,DABIR PRECITECH PRIVATE LIMITED,"F-60, Engineering Zone, Anand Nagar, Industrial Area, Ambernath, Maharashtra E) - 421506, India",https://www.dabirprecitech.com/,919892968290,NA,"India, Europe, Etc.",NA,"Automotive,Aerospace,Defense,Machinery & Equipments,Steel,Oil & Gas,Consumer Goods,Healthcare,Robotics,Hardware Startups,Electrical & Electronics","Investment Casting,CNC Machining",NA,"ISO 9001,ISO 13485","Manual,CMM",NA,NA,26000 Sq. Ft.,Yes,Yes,Yes,100,60,8,2,6,Yes,250+ Employees,NA,NA,Anand,Marketing Manager,dabir.precitech@rediffmail.com,9892968290,,,,,,
194,Daksh Tools & Appliances Pvt. Ltd,"55, Udyog Vihar, Udyog Vihar Phase 1, Dundahera Village, Sector 20, Gurugram, Haryana 122016, India",https://www.dakshtools.com,910124400436,NA,"India, Europe, Etc",NA,"Automotive,Electrical & Electronics,Hardware Startups,Robotics,Consumer Goods,Machinery & Equipments",Sheet Metal Stamping,NA,ISO 9001,Manual,NA,NA,NA,Yes,Yes,Yes,NA,70,NA,NA,NA,NA,50+ Employees,NA,NA,Parag,Director,parag@dakshtools.com,9810121992,,,,,,
195,Formtech Solutions,NA,https://formtech.org.in/,919003131569,"Hyundai, Daimler, M/S.MSGI AUTOMOTIVE PVT LTD M/S. MSI AUTOMOTIVE PVT LTD",India,NA,"Automotive,Machinery & Equipments,Steel,Oil & Gas,Consumer Goods,Robotics,Hardware Startups,Electrical & Electronics","Laser Cutting,Welding,Sheet Metal Stamping,Sheet Metal Bending,Sheet Metal Fabrication","Laser Cutting: Steel,Laser Cutting: Aluminium,Laser Cutting: Brass,Laser Cutting: Copper",ISO 9001,Manual,"Control Plan(CP) Production part approval process(PPAP) Inspection standard, Deviation report","3C, 5S & FIFO",5000 sq ft,Yes,Yes,Yes,NA,70,12,Yes,6,NA,25 + Employees,NA,NA,Rajamani,Partner,formtechsales@gmail.com,9003131569,SELVAM,Partner,selvamthangaraj87@gmail.com,7305056602,,
196,MSA Metal Stamping Automotive Pvt Ltd.,"204, Sri Meenakshi Amman Nagar Irungattukottai, Sriperumbudur, Tamil Nadu 602105, India",https://metalstampingautomotive.in/,919500028033,"Ford, Hyundai, Renault, Nissan, Hwashin Automotive India Pvt. Ltd, Dong Sung Automotive India Pvt. Ltd, etc.",India,5000 Lakhs,"Automotive,Aerospace,Defense,Machinery & Equipments,Steel,Oil & Gas,Consumer Goods,Robotics,Hardware Startups","Sheet Metal Stamping,Welding",NA,IATF 16949,Manual,NA,NA,"20,000 sq ft",Yes,Yes,Yes,NA,70,8,3,6,NA,NA,NA,NA,Arasu,Managing Director,msa_chennai@yahoo.in,9500028033,,,,,,
